### ISSUE TITLE
ACL's drop action for traffic in direction to CPU is not working

### ISSUE THREAD

**Issue by pawelmaslanka** [Azure/SONiC#431]
Hi SONiC team,

Generally speaking, my goal is to create ACL rule which will block control plane traffic in direction to CPU on specific L3 interface, e.g. prevent SSH from peer side via one of IPs assigned to interface on the SONiC side.
On the SONiC device, I have configured interface _Ethernet124_ in the following way:
> root@spine01:~# ip addr show Ethernet124
39: Ethernet124: <BROADCAST,MULTICAST,UP,LOWER_UP> mtu 9100 qdisc pfifo_fast state UP group default qlen 1000
    link/ether 00:e0:ec:94:4e:6a brd ff:ff:ff:ff:ff:ff
    inet 192.168.240.0/31 scope global Ethernet124
       valid_lft forever preferred_lft forever
    inet6 fe80::2e0:ecff:fe94:4e6a/64 scope link
       valid_lft forever preferred_lft forever

My peer side have IP address _192.168.240.1/31_. On the beginning there aren't any ACL rules provided by me.
Next, I provide basic setup of ACL rules in _config_db.json_ file in order to deny traffic from peer side to the SONiC device (traffic in direction to CPU via Ethernet124):
> "ACL_TABLE": {
        "DATAACL": {
            "policy_desc": "DATAACL",
            "ports": [
                "Ethernet124"
            ],
            "type": "L3"
        },
        "SNMP_ACL": {
            "policy_desc": "SNMP_ACL",
            "services": [
                "SNMP"
            ],
            "type": "CTRLPLANE"
        },
        "SSH_ONLY": {
            "policy_desc": "SSH_ONLY",
            "services": [
                "SSH"
            ],
            "type": "CTRLPLANE"
        }
    },
    "ACL_RULE": {
        "SNMP_ACL|DEFAULT_RULE": {
            "PRIORITY": "5",
            "PACKET_ACTION": "DROP",
            "ETHER_TYPE": "2048"
        },
        "SSH_ONLY|DEFAULT_RULE": {
            "PRIORITY": "5",
            "PACKET_ACTION": "DROP",
            "ETHER_TYPE": "2048"
        },
	"DATAACL|CATCH_ALL": {
	    "PRIORITY": "2",
	    "IP_TYPE": "ipv4any",
	    "PACKET_ACTION": "DROP"
	},
	"DATAACL|CATCH_CTRL_PLANE_ETHERNET124": {
	    "PRIORITY": "1",
	    "DST_IP": "192.168.240.0/31",
	    "SRC_IP": "192.168.240.1/31",
	    "PACKET_ACTION": "DROP"
	}
    },

I successfully reloaded configuration by issue the following command:
> root@spine01:~# config reload -y

After applied ACL rules that I start capture any traffic for interface _Ethernet124_ on SONiC side.
Now I do basic test from peer side:
> root@tor01:~# ssh admin@192.168.240.0
admin@192.168.240.0's password:

Statistics for my ACL rules are empty (output from issued command: _aclshow -a_).
Now I back to SONiC device and... looks like ACL rule doesn't work because there is captured traffic from peer side (from initialized SSH session):
> root@spine01:~# tcpdump -i Ethernet124
tcpdump: verbose output suppressed, use -v or -vv for full protocol decode
listening on Ethernet124, link-type EN10MB (Ethernet), capture size 262144 bytes
05:09:10.276109 IP 192.168.240.1.50156 > 192.168.240.0.ssh: Flags [S], seq 3490251644, win 27180, options [mss 9060,sackOK,TS val 21825047 ecr 0,nop,wscale 7], length 0
05:09:10.276196 IP 192.168.240.0.ssh > 192.168.240.1.50156: Flags [S.], seq 2038331746, ack 3490251645, win 27144, options [mss 9060,sackOK,TS val 914220 ecr 21825047,nop,wscale 7], length 0
05:09:10.276361 IP 192.168.240.1.50156 > 192.168.240.0.ssh: Flags [.], ack 1, win 213, options [nop,nop,TS val 21825047 ecr 914220], length 0
05:09:10.276984 IP 192.168.240.1.50156 > 192.168.240.0.ssh: Flags [P.], seq 1:41, ack 1, win 213, options [nop,nop,TS val 21825047 ecr 914220], length 40
...

Move forward, I dump ACL table/rules/stats:
> root@spine01:# show acl table
Name      Type       Binding      Description
SNMP_ACL  CTRLPLANE  SNMP         SNMP_ACL
SSH_ONLY  CTRLPLANE  SSH          SSH_ONLY
DATAACL   L3         Ethernet128    DATAACL

> root@spine01:# show acl rule
Table     Rule                          Priority    Action    Match
SNMP_ACL  DEFAULT_RULE                  5           DROP      ETHER_TYPE: 2048
SSH_ONLY  DEFAULT_RULE                  5           DROP      ETHER_TYPE: 2048
DATAACL   CATCH_ALL                     2           DROP      IP_TYPE: ipv4any
DATAACL   CATCH_CTRL_PLANE_ETHERNET124  1           DROP      DST_IP: 192.168.240.0/31
                                                                                                                 SRC_IP: 192.168.240.1/31

> root@spine01:# aclshow -a
RULE NAME                     TABLE NAME      PRIO  PACKETS COUNT    BYTES COUNT
CATCH_ALL                     DATAACL            2  134              11723
CATCH_CTRL_PLANE_ETHERNET124  DATAACL            1  0                0
DEFAULT_RULE                  SNMP_ACL           5  N/A              N/A
DEFAULT_RULE                  SSH_ONLY           5  N/A              N/A

The interested thing is that counter related to ACL rule called _CATCH_ALL_ has been increased by _caught_ traffic (so my traffic hit this ACL rule). I repeated my test after reboot SONiC device but I experienced the same behaviour.
Because my SONiC device is based on Broadcom ASIC, I checked also FP rules on it, but it looks like FP entry is installed correctly and doesn't have any extra action except only one - just drop action.
Currently, I'm working on build from branch _201904_:
> root@spine01:~# show version
SONiC Software Version: SONiC.HEAD.50-b62e120c
Distribution: Debian 9.9
Kernel: 4.9.0-9-2-amd64
Build commit: b62e120c
Build date: Thu Jul 25 05:58:06 UTC 2019
Built by: johnar@jenkins-worker-7
Platform: x86_64-cel_seastone-r0
HwSKU: Seastone-DX010
ASIC: broadcom
Serial Number: DX010B2F108710AK100006
Uptime: 05:37:59 up  1:34,  1 user,  load average: 0.21, 0.42, 0.42
Docker images:
REPOSITORY                 TAG                 IMAGE ID            SIZE
docker-syncd-brcm          HEAD.50-b62e120c    25f90aaf2752        393MB
docker-syncd-brcm          latest              25f90aaf2752        393MB
docker-lldp-sv2            HEAD.50-b62e120c    5ee19b07d3d3        299MB
docker-lldp-sv2            latest              5ee19b07d3d3        299MB
docker-orchagent           HEAD.50-b62e120c    f7768ad65c8d        320MB
docker-orchagent           latest              f7768ad65c8d        320MB
docker-dhcp-relay          HEAD.50-b62e120c    09ebe73fc9c2        288MB
docker-dhcp-relay          latest              09ebe73fc9c2        288MB
docker-database            HEAD.50-b62e120c    0cc39292f42c        281MB
docker-database            latest              0cc39292f42c        281MB
docker-snmp-sv2            HEAD.50-b62e120c    ebb51b754c93        313MB
docker-snmp-sv2            latest              ebb51b754c93        313MB
docker-teamd               HEAD.50-b62e120c    709ea9442645        302MB
docker-teamd               latest              709ea9442645        302MB
docker-sonic-telemetry     HEAD.50-b62e120c    ef8c94d47539        303MB
docker-sonic-telemetry     latest              ef8c94d47539        303MB
docker-router-advertiser   HEAD.50-b62e120c    299c840974d7        280MB
docker-router-advertiser   latest              299c840974d7        280MB
docker-platform-monitor    HEAD.50-b62e120c    ecb3c47dd362        326MB
docker-platform-monitor    latest              ecb3c47dd362        326MB
docker-fpm-frr             HEAD.50-b62e120c    377efdf6f4ab        310MB
docker-fpm-frr             latest              377efdf6f4ab        310MB

But I did the same thing with the release _201811_ and I observed the same result.

Guys, do you have any idea how I could further debug this issue? Or, is there on SONiC implemented ACL for traffic in direction  to CPU? Or should I provide more specific info for you?

Thanks in advance for your help.

Best,
Pawel

**Comment by pawelmaslanka** [comment]
Hi folks,

I was digging deeper this topic by myself and I found Python script called _caclmgrd_ . According to the header in this file:
> Control plane ACL manager daemon for SONiC
>  Upon starting, this daemon reads control plane ACL tables and rules from
>  Config DB, converts the rules into iptables rules and installs the iptables
>  rules. The daemon then indefintely listens for notifications from Config DB
>  and updates iptables rules if control plane ACL configuration has changed.

it looks like Control Plane ACL are realized as _firewall_ in Linux host, am I right?
So there isn't support for Control Plane by ASIC? Or there are some events after configure _iptables_ in Linux kernel and are somehow later propagate via SAI to ASIC?

Thanks,
Pawel
